{"schema":"chancadem.hp500.loo/v1","source":{"paper":"Rocha, Campos, Silva & Tavares 2024","doi":"10.3390/min14090919","license":"CC BY 4.0","table":"A1 (measured) + 5 (fit)"},"engine_version":"0.11.000","n":10,"seed":42,"config":{"resid_clip_frac":0.2,"ridge_lambda":1.0,"features":["cssMm","f80Mm"],"targets_primary":["tph","kW"],"target_secondary":["p80"]},"loo":{"tph":{"target":"tph","measured":[1639.0,1267.0,1240.0,1034.0,1124.0,813.0,1050.0,1138.0,820.0,1334.0],"strict":{"M0_backbone":{"mape_pct":12.09,"rmse":176.67,"r2":0.423,"maxdev_pct":28.84},"M1_residual":{"mape_pct":13.45,"rmse":189.49,"r2":0.337,"maxdev_pct":23.24},"M2_freeform":{"mape_pct":12.18,"rmse":174.42,"r2":0.438,"maxdev_pct":20.89},"constant_mean":{"mape_pct":18.29,"rmse":258.52,"r2":-0.235,"maxdev_pct":45.5},"M1_label_shuffle":{"mape_pct":25.04,"rmse":322.81,"r2":-0.925,"maxdev_pct":54.61},"pred":{"M0":[1231.9,1283.78,1165.8,1189.35,1179.06,1047.49,988.36,1097.55,1046.89,1294.85],"M1":[1258.17,1438.17,992.07,1223.59,1131.93,929.6,832.99,1123.25,931.0,1452.4],"M2":[1319.83,1441.7,980.99,1205.99,1117.0,897.8,838.88,1134.27,900.73,1463.71]},"uq":{"sigma":186.09,"band_halfwidth":238.5,"nominal_coverage":0.8,"empirical_coverage":0.9,"band_rel_pct":20.81,"note":"80% interval = M0 +- 1.2816*sigma(held-out residual). n=10 makes coverage a coarse estimate.","nested_coverage":0.8,"nested_covered":[false,true,true,true,true,false,true,true,true,true],"nested_sigma":[123.24,197.35,195.07,189.44,196.55,178.18,195.74,196.6,179.5,196.64],"nested_note":"empirical_coverage is in sample: sigma comes from the same ten held-out residuals it is checked against. nested_coverage is out of sample: for each survey, sigma comes from the held-out residuals of the other nine surveys only, and the survey is covered when its residual lies within 1.2816 times that sigma. n=10 makes both coarse: one survey moves a coverage by 0.1."}},"leaky":{"M0_backbone":{"mape_pct":10.95,"rmse":158.2,"r2":0.538,"maxdev_pct":26.57},"M1_residual":{"mape_pct":8.51,"rmse":120.48,"r2":0.732,"maxdev_pct":15.19},"M2_freeform":{"mape_pct":8.24,"rmse":119.65,"r2":0.736,"maxdev_pct":14.89},"constant_mean":{"mape_pct":16.46,"rmse":232.67,"r2":0.0,"maxdev_pct":40.95},"M1_label_shuffle":{"mape_pct":21.18,"rmse":300.42,"r2":-0.667,"maxdev_pct":51.88},"pred":{"M0":[1281.73,1281.73,1173.41,1173.41,1173.41,1028.99,992.89,1101.21,1028.99,1299.78],"M1":[1390.06,1381.15,1093.77,1185.04,1127.16,891.66,959.12,1126.29,896.11,1408.64],"M2":[1407.35,1396.65,1078.31,1187.99,1118.43,871.43,961.5,1135.38,876.78,1425.18]}}},"kW":{"target":"kW","measured":[209.0,212.0,262.0,349.0,325.0,355.0,306.0,325.0,350.0,187.0],"strict":{"M0_backbone":{"mape_pct":25.94,"rmse":78.52,"r2":-0.622,"maxdev_pct":49.45},"M1_residual":{"mape_pct":25.37,"rmse":92.09,"r2":-1.231,"maxdev_pct":73.28},"M2_freeform":{"mape_pct":14.03,"rmse":48.67,"r2":0.377,"maxdev_pct":29.36},"constant_mean":{"mape_pct":24.48,"rmse":68.5,"r2":-0.235,"maxdev_pct":60.01},"M1_label_shuffle":{"mape_pct":40.19,"rmse":110.53,"r2":-2.214,"maxdev_pct":76.26},"pred":{"M0":[283.69,275.13,288.32,276.3,247.1,284.18,457.33,312.53,287.07,276.49],"M1":[238.39,234.58,345.98,247.55,260.74,315.98,530.25,250.02,317.76,245.97],"M2":[225.17,226.66,321.57,268.87,282.47,358.55,395.85,284.04,359.06,226.92]},"uq":{"sigma":81.98,"band_halfwidth":105.06,"nominal_coverage":0.8,"empirical_coverage":0.9,"band_rel_pct":36.48,"note":"80% interval = M0 +- 1.2816*sigma(held-out residual). n=10 makes coverage a coarse estimate.","nested_coverage":0.9,"nested_covered":[true,true,true,true,true,true,false,true,true,true],"nested_sigma":[83.63,84.73,86.76,81.19,80.42,81.45,69.41,86.52,82.49,81.86],"nested_note":"empirical_coverage is in sample: sigma comes from the same ten held-out residuals it is checked against. nested_coverage is out of sample: for each survey, sigma comes from the held-out residuals of the other nine surveys only, and the survey is covered when its residual lies within 1.2816 times that sigma. n=10 makes both coarse: one survey moves a coverage by 0.1."}},"leaky":{"M0_backbone":{"mape_pct":19.28,"rmse":54.97,"r2":0.205,"maxdev_pct":36.46},"M1_residual":{"mape_pct":12.0,"rmse":39.4,"r2":0.592,"maxdev_pct":21.13},"M2_freeform":{"mape_pct":9.46,"rmse":33.18,"r2":0.71,"maxdev_pct":20.56},"constant_mean":{"mape_pct":22.03,"rmse":61.65,"r2":0.0,"maxdev_pct":54.01},"M1_label_shuffle":{"mape_pct":15.5,"rmse":45.9,"r2":0.446,"maxdev_pct":24.29},"pred":{"M0":[274.47,264.25,285.67,283.74,261.77,291.37,355.02,314.93,293.61,255.17],"M1":[232.22,225.79,317.35,276.63,279.26,339.63,357.28,298.14,339.98,213.7],"M2":[220.74,222.88,299.19,277.26,291.17,357.44,343.66,296.23,356.37,215.06]}}},"p80":{"target":"p80","measured":[32.56,31.36,21.23,30.8,24.54,26.54,36.6,35.69,26.97,30.72],"strict":{"M0_backbone":{"mape_pct":0.0,"rmse":0.0,"r2":1.0,"maxdev_pct":0.0},"M1_residual":{"mape_pct":0.0,"rmse":0.0,"r2":1.0,"maxdev_pct":0.0},"M2_freeform":{"mape_pct":2.73,"rmse":0.9,"r2":0.962,"maxdev_pct":6.72},"constant_mean":{"mape_pct":15.51,"rmse":5.12,"r2":-0.235,"maxdev_pct":44.33},"M1_label_shuffle":{"mape_pct":6.33,"rmse":2.28,"r2":0.755,"maxdev_pct":20.0},"pred":{"M0":[32.56,31.36,21.23,30.8,24.54,26.54,36.6,35.69,26.97,30.72],"M1":[32.56,31.36,21.23,30.8,24.54,26.54,36.6,35.69,26.97,30.72],"M2":[31.83,31.2,22.66,30.11,25.2,25.67,38.3,35.88,26.07,31.06]},"uq":{"sigma":0.0,"band_halfwidth":0.0,"nominal_coverage":0.8,"empirical_coverage":1.0,"band_rel_pct":0.0,"note":"80% interval = M0 +- 1.2816*sigma(held-out residual). n=10 makes coverage a coarse estimate.","nested_coverage":1.0,"nested_covered":[true,true,true,true,true,true,true,true,true,true],"nested_sigma":[0.0,0.0,0.0,0.0,0.0,0.0,0.0,0.0,0.0,0.0],"nested_note":"empirical_coverage is in sample: sigma comes from the same ten held-out residuals it is checked against. nested_coverage is out of sample: for each survey, sigma comes from the held-out residuals of the other nine surveys only, and the survey is covered when its residual lies within 1.2816 times that sigma. n=10 makes both coarse: one survey moves a coverage by 0.1."}},"leaky":{"M0_backbone":{"mape_pct":0.0,"rmse":0.0,"r2":1.0,"maxdev_pct":0.0},"M1_residual":{"mape_pct":0.0,"rmse":0.0,"r2":1.0,"maxdev_pct":0.0},"M2_freeform":{"mape_pct":1.81,"rmse":0.56,"r2":0.985,"maxdev_pct":4.2},"constant_mean":{"mape_pct":13.96,"rmse":4.61,"r2":0.0,"maxdev_pct":39.9},"M1_label_shuffle":{"mape_pct":9.4,"rmse":3.4,"r2":0.455,"maxdev_pct":20.0},"pred":{"M0":[32.56,31.36,21.23,30.8,24.54,26.54,36.6,35.69,26.97,30.72],"M1":[32.56,31.36,21.23,30.8,24.54,26.54,36.6,35.69,26.97,30.72],"M2":[32.03,31.24,22.12,30.18,25.07,25.94,37.31,35.82,26.34,30.96]}}}},"power_parity":{"note":"In-sample power-parity contrast vs the 10 MEASURED kW. Adversarial finding: the engine Bond draw is nearly flat (it carries little information about the measured power spread), so neither the bare Bond draw nor the paper Pc=1.30*Pd+110 (whose Pd is the paper size-specific net power, not the classical Bond draw) reproduces the measured variation. The best least-squares refit of the paper FORM on our Bond Pd collapses toward the survey mean. No 2x-overprediction removal is claimed; the honest at-bar win is the t/h parity, not the power.","bond_pd_range_kw":[196.1,237.5],"measured_range_kw":[187.0,355.0],"bare_bond":{"mape_pct":26.88,"rmse":93.22,"r2":-1.286,"maxdev_pct":37.32},"engine_pc_1p30_110":{"mape_pct":47.58,"rmse":132.85,"r2":-3.643,"maxdev_pct":123.93},"refit_pc":{"mape_pct":19.28,"rmse":54.97,"r2":0.205,"maxdev_pct":36.46,"zeta":-2.4146,"pn":828.6},"constant_mean":{"mape_pct":22.03,"rmse":61.65,"r2":0.0,"maxdev_pct":54.01},"per_survey":[{"n":1,"css":54.0,"measured":209.0,"bare_bond":229.5,"engine_pc":408.3,"refit_pc":274.5},{"n":2,"css":54.0,"measured":212.0,"bare_bond":233.7,"engine_pc":413.9,"refit_pc":264.3},{"n":3,"css":48.0,"measured":262.0,"bare_bond":224.9,"engine_pc":402.3,"refit_pc":285.7},{"n":4,"css":48.0,"measured":349.0,"bare_bond":225.7,"engine_pc":403.4,"refit_pc":283.7},{"n":5,"css":48.0,"measured":325.0,"bare_bond":234.8,"engine_pc":415.2,"refit_pc":261.8},{"n":6,"css":40.0,"measured":355.0,"bare_bond":222.5,"engine_pc":399.3,"refit_pc":291.4},{"n":7,"css":38.0,"measured":306.0,"bare_bond":196.1,"engine_pc":365.0,"refit_pc":355.0},{"n":8,"css":44.0,"measured":325.0,"bare_bond":212.7,"engine_pc":386.6,"refit_pc":314.9},{"n":9,"css":40.0,"measured":350.0,"bare_bond":221.6,"engine_pc":398.0,"refit_pc":293.6},{"n":10,"css":55.0,"measured":187.0,"bare_bond":237.5,"engine_pc":418.7,"refit_pc":255.2}]},"tph_parity":{"note":"In-sample t/h parity: the calibrated Evertsson capacity backbone vs the 10 MEASURED t/h. This is the concrete, real at-bar result; the held-out (strict LOO) M0 t/h number above confirms it is not an in-sample artifact.","backbone":{"mape_pct":11.55,"rmse":171.36,"r2":0.458,"maxdev_pct":26.24},"per_survey":[{"n":1,"css":54.0,"measured":1639.0,"backbone":1208.9},{"n":2,"css":54.0,"measured":1267.0,"backbone":1208.9},{"n":3,"css":48.0,"measured":1240.0,"backbone":1106.7},{"n":4,"css":48.0,"measured":1034.0,"backbone":1106.7},{"n":5,"css":48.0,"measured":1124.0,"backbone":1106.7},{"n":6,"css":40.0,"measured":813.0,"backbone":970.5},{"n":7,"css":38.0,"measured":1050.0,"backbone":936.5},{"n":8,"css":44.0,"measured":1138.0,"backbone":1038.6},{"n":9,"css":40.0,"measured":820.0,"backbone":970.5},{"n":10,"css":55.0,"measured":1334.0,"backbone":1225.9}]}}